{
  "sample_id": "sample-native-001",
  "run_id": "draft-run-v1-native-r1",
  "sample_time_us": 9000000,
  "clock_domain": "pi_monotonic",
  "sampling_scope": "process",
  "workload_id": "native:mosquitto",
  "service_id": "mqtt_broker",
  "host_id": "PI5_OCC",
  "process_identity": "mosquitto",
  "container_identity": null,
  "pod_identity": null,
  "cpu_usage_cores": 0.25,
  "cpu_capacity_cores": null,
  "memory_used_bytes": 50000000,
  "active_connections": 1,
  "queue_depth": null,
  "measurement_window_us": 1000000,
  "aggregation_definition": null,
  "dataset_schema_version": "1.0",
  "scope_instance_id": "native:mosquitto",
  "metric_aggregation_methods": null,
  "aggregation_member_scope": null,
  "aggregation_member_ids": [],
  "collector_name": "DRAFT-COLLECTOR",
  "collector_version": "DRAFT-VERSION",
  "collection_method": "DRAFT-METHOD"
}
